<?xml version="1.0" encoding="UTF-8"?>

<!DOCTYPE transcription SYSTEM "DTD10-10-2014.dtd">

<transcription xmlns:xsi="http://www.w3.org/2001/XMLSchema-instance"
 xsi:noNamespaceSchemaLocation="file:/C:/Users/User1/Documents/GitHub/AORCLONEJG/XMLschema/Harveyschema17102014.xsd">
    
    <page filename="00000011.tif" signature="[a3r]" reader="Harvey" />
    <annotation>
        <marginalia hand="Italian">
            <language ident="LA">
                <position place="right_margin" book_orientation="0">
                    <marginalia_text>Nota[e] solae notabiles, relicta[e]: reliqua[e], resecta[e].</marginalia_text>
                </position>
            </language>
            <translation> Only the noteworthy notes are left, the others have been cut.</translation>
        </marginalia>
        <marginalia hand="Italian">
            <language ident="LA">
                <position place="tail" book_orientation="0">
                    <marginalia_text>Liuius, Romana[e] historia[e] facil&egrave; princeps. Singuli
                    libri, in suo genere pra[e]stantissimi. Pulcherrimorum mnemosynoru[m] mira
                    varietas. Nemo historicorum aut magis serio obseruat, aut tam graphi&egrave; pingit. 
                    Hunc nesciunt, qui vel Gra[e]cos historicos nimium admirantur, vel alios Romanos immoderat&egrave;
                    efferunt. Mihi cordi est, omne elocutionis, prudentia[e]q[ue] punctum in Liuio peruestigare.
                    De stylo Liuiano, pra[e]sertim in concionibus, meam inf&agrave; sententiam attexui.</marginalia_text>
                    <person name="Livy"/>
                </position>
            </language>
            <translation>Livy is easily the master of Roman history. Every single book is the most outstanding in its sort. 
                There is a wonderful diversity of the most beautiful memorials. None of the historians observes more earnestly, 
                or depicts so vividly. Those who marvel excessively at the Greek historians, 
                or immoderately exalt other Roman historians do not know him. 
                It is a delight for me to analyze every point of eloquence and sagacity in Livy in detail. 
                As for Livyâ€™s style, especially in the speeches, I have attached my assessment below.</translation>
        </marginalia>
        
        <underline method="pen" type="straight" language="LA" text="sol&ugrave;m Liuium emandauimus"/>
        <underline method="pen" type="straight" language="LA" text="quodammodo illustrauimus"/>
        <underline method="pen" type="straight" language="LA" text="sed mensuraru[m]"/>
        <underline method="pen" type="straight" language="LA" text="req[ue]; numaria"/>
        <underline method="pen" type="straight" language="LA" text="ad uyeterm historia[m] intelligendam"/>
        <underline method="pen" type="straight" language="LA" text="vitamq[ue]; co[m]munem gubernandam"/>
        <underline method="pen" type="straight" language="LA" text="uectigaliu[m]"/>
        <underline method="pen" type="straight" language="LA" text="pensionum"/>
        <underline method="pen" type="straight" language="LA" text="fructuum summas intelligent"/>
        <underline method="pen" type="straight" language="LA" text="precia estimabunt"/>
        <underline method="pen" type="straight" language="LA" text="ad nostri temporis"/>
        <underline method="pen" type="straight" language="LA" text="ponderu[m] mensurarumq[ue]; ratione instructi"/>
        <underline method="pen" type="straight" language="LA" text="mensuris"/>
        <underline method="pen" type="straight" language="LA" text="ponderibus"/>
        <underline method="pen" type="straight" language="LA" text="pecuniaru[m]q[ue]"/>
        <underline method="pen" type="straight" language="LA" text="Duo"/>
        <underline method="pen" type="straight" language="LA" text="ea ipsa"/>
        <underline method="pen" type="straight" language="LA" text="locorum"/>
        <underline method="pen" type="straight" language="LA" text="locorum"/>
        <underline method="pen" type="straight" language="LA" text="h[a]ec quoq[ue] pars" />
        <underline method="pen" type="straight" language="LA" text="Leonardo Poritio Vicentino"/>
        <underline method="pen" type="straight" language="LA" text="Gul. Budaeo"/>
        <underline method="pen" type="straight" language="LA" text="Andrea Alciato"/>
        <underline method="pen" type="straight" language="LA" text="Georgio Agricola"/>
        <underline method="pen" type="straight" language="LA" text="ex illorum uarijs copiosisq[ue]"/>
        <underline method="pen" type="straight" language="LA" text="saepe inter se dissidentibus sententijs"/>
        <underline method="pen" type="straight" language="LA" text="certam aliquam"/>
        <underline method="pen" type="straight" language="LA" text="eamq[ue] ordine describere"/>
        <underline method="pen" type="straight" language="LA" text="Liuio, Romanae historiae facil&egrave; principe"/>
        <underline method="pen" type="straight" language="LA" text="longae inquisitionis"/>
        <underline method="pen" type="straight" language="LA" text="quae res"/>
        <underline method="pen" type="straight" language="LA" text="mod&ograve; historiae"/>
        <underline method="pen" type="straight" language="LA" text="etiam Iurisconsultis"/>
        <underline method="pen" type="straight" language="LA" text="medicinaeq[ue] studiosis, utilis erit"/>
        <underline method="pen" type="straight" language="LA" text="Latinis sol&ugrave;m ponderibus"/>
        <underline method="pen" type="straight" language="LA" text="Graecis intelligendis"/>
        <underline method="pen" type="straight" language="LA" text="Doctorum"/>
        <underline method="pen" type="straight" language="LA" text="annotationes &amp;"/>
        <underline method="pen" type="straight" language="LA" text="ut uno ordine, unaq[ue] serie, suis aptis &amp;"/>
        <underline method="pen" type="straight" language="LA" text="partim leues"/>
        <underline method="pen" type="straight" language="LA" text="falsae"/>
        <underline method="pen" type="straight" language="LA" text="non necessarie"/>
        <underline method="pen" type="straight" language="LA" text="ijs mod&ograve; relictis"/>
        <underline method="pen" type="straight" language="LA" text="insignem aliquam utilitatem continerent"/>
        <underline method="pen" type="straight" language="LA" text="de Liuio ipso"/>
        <underline method="pen" type="straight" language="LA" text="Liuius ipse dignus alioquisit, qui semper"/>
        <underline method="pen" type="straight" language="LA" text="laudetur, placeat, uigeat, relegatur, ametur"/>
        
        <symbol name="SS" place="right_margin" />
        <symbol name="JC" place="right_margin"/>
        <symbol name="SS" place="intext"/> <!-- sem- -->
        
        <mark name="equal_sign" method="pen" place="left_margin"/>
        <mark name="equal_sign" method="pen" place="left_margin"/>
        <mark name="X_sign" method="pen" place="right_margin"/> <!--numaria-->
        <mark name="X_sign" method="pen" place="right_margin"/> <!--numaria-->
        <mark name="quotation_mark" method="pen" place="right_margin"/> <!--intelligendam-->
        <mark name="straight_quotation_mark" method="pen" place="right_margin"/> 
        <mark name="straight_quotation_mark" method="pen" place="right_margin"/> 
        <mark name="straight_quotation_mark" method="pen" place="right_margin"/> 
        <mark name="straight_quotation_mark" method="pen" place="right_margin"/> 
        <mark name="straight_quotation_mark" method="pen" place="right_margin"/> 
        <mark name="X_sign" method="pen" place="right_margin"/> <!--medico-->
        <mark name="equal_sign" method="pen" place="right_margin"/> <!--aliquam-->
        <mark name="equal_sign" method="pen" place="right_margin"/> <!-- fri- -->
        <mark name="dash" method="pen" place="right_margin"/> <!--grafiti-->
        <mark name="dash" method="pen" place="right_margin"/> <!--scho-->
        <mark name="dash" method="pen" place="right_margin"/> <!--quaeren-->
        
        <mark name="dot" method="pen" place="intext"/> <!--co[n]suleremus, non-->
        <mark name="plus_sign" method="pen" place="intext" language="LA" text="mensuraru[m]"/> 
        <mark name="plus_sign" method="pen" place="intext" language="LA" text="po[n]derum"/> 
        <mark name="plus_sign" method="pen" place="intext" language="LA" text="po[n]derum"/>
        <mark name="plus_sign" method="pen" place="intext" language="LA" text="mensuraru[m]"/>
        <mark name="dot" method="pen" place="intext"/> <!--diximus, tum-->
        <mark name="equal_sign" method="pen" place="intext"/> <!-- loco- -->
        <mark name="equal_sign" method="pen" place="intext"/> <!-- h[a]ec-->
        <mark name="plus_sign" method="pen" place="intext" language="LA" text="certam"/>
        <mark name="dot" method="pen" place="intext"/> <!--co[n]plecti, ac-->
        <mark name="vertical_bar" method="pen" place="intext"/> <!--after intelligendis-->
        <mark name="dot" method="pen" place="intext"/> <!--autorem, quae-->
        <mark name="dot" method="pen" place="intext"/> <!--erant, eas-->        
        <mark name="equal_sign" method="pen" place="intext"/> <!-- uno ordine -->
        <mark name="plus_sign" method="pen" place="intext" language="LA" text="insignem[m]"/>
        <mark name="vertical_bar" method="pen" place="intext"/> <!--before Itaq[ue]-->
        
        
    </annotation>
</transcription>
