<?xml version="1.0" standalone="no" ?>

<!DOCTYPE transcription SYSTEM "DTD10-10-2014.dtd">

<transcription>
    <page filename="Ha2.005v.tif" pagination="330" reader="Harvey"/> <!-- ABO 10left -->
    <annotation>
        
        <!-- Marginalia -->
        <marginalia hand="Italian">
            <language ident="EN">
                <position place="head" book_orientation="0">
                    <marginalia_text>
                      Eutrapelus scornes himself, till he teaches all
                    </marginalia_text>
                	<person name="Eutrapelus"/>
                </position>
            	<position place="left_margin" book_orientation="0">
            		<marginalia_text>
            			other, to pronounce more
            		</marginalia_text>
            		<emphasis method="chalk"/>
            	</position>
            	<position place="intext" book_orientation="0">
            		<marginalia_text>
            			sensibly; to expresse more liuely; to speake
            		</marginalia_text>
            	</position>
            	<position place="left_margin" book_orientation="0">
            		<marginalia_text>
            			more effectually; to resolue &amp; persuade
            			more powrefully, 
            		</marginalia_text>
            	</position>
            	<position place="intext" book_orientation="0">
            		<marginalia_text>
            			then anie other heretofore.
            		</marginalia_text>
            	</position>
            </language>
        </marginalia>
    	<marginalia hand="Italian">
    		<language ident="IT">
    			<position place="intext" book_orientation="0">
    				<marginalia_text>
    					ridicolo. )
    				</marginalia_text>
    			</position>
    		</language>
    	</marginalia>
    	<marginalia hand="Italian">
    		<language ident="IT">
    			<position place="intext" book_orientation="0">
    				<marginalia_text>
    					ridicolo.
    				</marginalia_text>
    			</position>
    		</language>
    		<language ident="LA">
    			<position place="intext" book_orientation="0">
    				<marginalia_text>
    					problemata, et aenigmata plebea. )
    				</marginalia_text>
    				<emphasis method="chalk"/>
    			</position>
    		</language>
    	</marginalia>
    	<marginalia hand="Italian">
    		<language ident="LA">
    			<position place="intext" book_orientation="0">
    				<marginalia_text>
    					necessaria non necessarijs: prudens electio.
    					Hoc agit: nec curat parerga.
    				</marginalia_text>
    			</position>    			
    		</language>
    	</marginalia>
    	<marginalia hand="Italian">
    		<language ident="IT">
    			<position place="tail" book_orientation="0">
    				<marginalia_text>
    					ridicolo. fantastico.
    				</marginalia_text>
    			</position>
    		</language>
    	</marginalia>
    	<marginalia hand="Italian">
    		<language ident="EN">
    			<position place="tail" book_orientation="0">
    				<marginalia_text>
    					Lett Eutrapelus excell all other in speaking, designing
    					&amp; doing: or lett Eutrapelus be accounted a
    					meacock, &amp; a base fellow.
    				</marginalia_text>
    				<person name="Eutrapelus"/>
    				<emphasis method="chalk"/>
    			</position>
    		</language>
    	</marginalia>
    	<marginalia hand="Italian">
    		<language ident="LA">
    			<position place="left_margin" book_orientation="90">
    				<marginalia_text>
    					&Ocirc; sordide, vbi sunt aetheri spiritus?
    				</marginalia_text>
    				<emphasis method="chalk"/>
    			</position>
    		</language>
    	</marginalia>
    	<marginalia hand="Italian">
    		<language ident="EN">
    			<position place="right_margin" book_orientation="270">
    				<marginalia_text>
    					Alwais sum singularitie in action, or counsell: in speach, or behauiour.
    				</marginalia_text>
    				<emphasis method="chalk"/>
    			</position>
    		</language>
    	</marginalia>
        
        <!-- Underlines -->
        
    	<underline method="pen" type="straight" language="IT" text="si cerca"/>
    	<underline method="pen" type="straight" language="IT" text="uorrebbe trouare"/>
    	<underline method="pen" type="straight" language="IT" text="una ricamatrice"/>
    	<underline method="pen" type="straight" language="IT" text="la piu pulita arte"/>
    	<underline method="pen" type="straight" language="IT" text="Fornaciai, i quali"/>
    	<underline method="pen" type="straight" language="IT" text="cacare, che"/>
    	<underline method="pen" type="straight" language="IT" text="lauino prima le mani"/>
    	<underline method="pen" type="straight" language="IT" text="la lepre si"/>
    	<underline method="pen" type="straight" language="IT" text="guardare in dietro"/>
    	<underline method="pen" type="straight" language="IT" text="i cani le danno"/>
    	<underline method="pen" type="straight" language="IT" text="non ha gli occhi al culo"/>
    	<underline method="pen" type="straight" language="IT" text="Giuochi Carnascialeschi"/>
    	<underline method="pen" type="straight" language="IT" text="Giuliano de' Medici"/>
    	<underline method="pen" type="straight" language="IT" text="alla guardispensa"/>
    	<underline method="pen" type="straight" language="IT" text="gran Signore passaua"/>
    	<underline method="pen" type="straight" language="IT" text="si passi: io uu&ograve; cacare"/>
    	<underline method="pen" type="straight" language="IT" text="gi&agrave; in prouerbio"/>
    	<underline method="pen" type="straight" language="IT" text="Puossi scusare"/>
    	<underline method="pen" type="straight" language="IT" text="nuouo pesce"/>
    	<underline method="pen" type="straight" language="IT" text="Lionardo"/>
    	<underline method="pen" type="straight" language="IT" text="Aretino"/>
    	<underline method="pen" type="straight" language="IT" text="Carluzzo"/>
    	<underline method="pen" type="straight" language="IT" text="Lionardazzo"/>
    	<underline method="pen" type="straight" language="IT" text="h&ograve; parecchi lettere Greghe"/>
    	<underline method="pen" type="straight" language="IT" text="tutti nel merdazzo"/>
    	<underline method="pen" type="straight" language="IT" text="Greche"/>
    	<underline method="pen" type="straight" language="IT" text="andare in Costantinopoli"/>
    	<underline method="pen" type="straight" language="IT" text="inciampato a Napoli"/>
    	<underline method="pen" type="straight" language="IT" text="s'innamor&ograve; di non"/>
    	<underline method="pen" type="straight" language="IT" text="quiui spese tutti i suoi denari"/>
    	<underline method="pen" type="straight" language="IT" text="scusso a Fiorenza"/>
    	<underline method="pen" type="straight" language="IT" text="sempre soggiungeua"/>
    	<underline method="pen" type="straight" language="IT" text="lettere Greghe"/>
    	<underline method="pen" type="straight" language="IT" text="appar&ograve; il Barghella"/>
    	
        <!-- Symbols: Asterisk|Bisected_circle|Crown|Crescent|JC|HT|LL|Mars|Mercury|Opposite_planets|Square|SS|Sun -->
        <!-- No apparent symbols -->
        
    	<!-- Marks: apostrophe|box|bracket|circumflex|comma|dash|dot|equal_sign|hash|horizontal_bar|plus_sign|quotation_mark|semicolon|tilde|triple_dash|vertical_bar|X_sign -->
    	<!-- Right margin -->
    	<mark name="dash" method="pen" place="right_margin"/> <!-- l'huo -->
    	<mark name="dash" method="pen" place="right_margin"/> <!-- ri -->
    	<mark name="dash" method="pen" place="right_margin"/> <!-- fa -->
    	<mark name="dash" method="pen" place="right_margin"/> <!-- dis -->
    	<mark name="plus_sign" method="pen" place="right_margin"/> <!-- cacare; & -->
    	<mark name="bracket" method="pen" place="right_margin"/> <!-- soleua ... lettere -->
    	<mark name="quotation_mark" method="pen" place="right_margin"/> <!-- io non -->
    	<mark name="quotation_mark" method="pen" place="right_margin"/> <!-- Greghe, -->
    	
    	<!-- Left margin -->
    	<mark name="quotation_mark" method="pen" place="left_margin" /> <!-- si lauino -->
    	<mark name="bracket" method="pen" place="left_margin" /> <!-- questo .. un fanciullo -->
    	<mark name="equal_sign" method="pen" place="left_margin" /> <!-- re passaua -->
    	<mark name="quotation_mark" method="pen" place="left_margin" /> <!-- & Lionardazzo -->
    	<mark name="vertical_bar" method="pen" place="left_margin" />
    	<mark name="bracket" method="pen" place="left_margin" /> <!-- pree ... che -->
    	    	
    	<!-- Intext -->
    	<mark name="vertical_bar" method="chalk" place="intext"/> <!-- Last paragraph on the left -->
    	<mark name="vertical_bar" method="chalk" place="intext"/> <!-- Last paragraph on the right -->
    	<mark name="plus_sign" method="pen" place="intext" text="cerca"/> <!--  -->
    	<mark name="plus_sign" method="pen" place="intext"/> <!-- trouare. ] -->
    	<mark name="plus_sign" method="pen" place="intext"/> <!-- piu pulita -->
    	<mark name="dot" method="pen" place="intext"/> <!-- sua, quelli -->
    	<mark name="vertical_bar" method="pen" place="intext"/> <!-- mani . Et -->
    	<mark name="dot" method="pen" place="intext"/> <!-- caccia, dis -->
    	<mark name="dot" method="pen" place="intext"/> <!-- passaua, & -->
    	<mark name="vertical_bar" method="pen" place="intext"/> <!-- ; & -->
    	<mark name="plus_sign" method="pen" place="intext"/> <!-- fanciullo.] -->
    	<mark name="quotation_mark" method="pen" place="intext"/> <!-- & soleua -->
    	<mark name="dot" method="pen" place="intext"/> <!-- pesce, & -->
    	<mark name="quotation_mark" method="pen" place="intext"/> <!-- Straight quotes. Carluzzo, -->
    	<mark name="plus_sign" method="pen" place="intext"/> <!-- lettere Greghe -->
    	<mark name="vertical_bar" method="pen" place="intext"/> <!-- merdazzo. Et -->
        
    </annotation>
</transcription>
